[{"category":"blocks","constraints":{"incompatible_with":[]},"description":"DenseNet: each layer connects to all previous","help_md":"### Technical\nDenseNet: each layer connects to all previous\n\nInputs: x:tensor[B, S, D].\nOutputs: y:tensor[B, S, D].\nParams: none.\n\n### Plain Language\nDenseNet: each layer connects to all previous\n\nUse when you need this specific transformation in a workflow.\n","id":"dense_net","implementation":{"cython":null,"native":null,"python":"kernel_fallback.py","rust":null},"inputs":[{"dtype":"tensor","name":"x","shape":["B","S","D"]}],"name":"Dense Net","outputs":[{"dtype":"tensor","name":"y","shape":["B","S","D"]}],"params":{},"performance":{"has_params":true,"numerically_risky":false,"param_formula":"D*D","preserves_gradient":true},"status":"approved","tags":["dense_connections","topology"],"version":"1.0.0"},{"category":"blocks","constraints":{"incompatible_with":[]},"description":"Feedback connections from later to earlier layers","help_md":"### Technical\nFeedback connections from later to earlier layers\n\nInputs: x:tensor[B, S, D].\nOutputs: y:tensor[B, S, D].\nParams: none.\n\n### Plain Language\nFeedback connections from later to earlier layers\n\nUse when you need this specific transformation in a workflow.\n","id":"feedback_loop","implementation":{"cython":null,"native":null,"python":"kernel_fallback.py","rust":null},"inputs":[{"dtype":"tensor","name":"x","shape":["B","S","D"]}],"name":"Feedback Loop","outputs":[{"dtype":"tensor","name":"y","shape":["B","S","D"]}],"params":{},"performance":{"has_params":true,"numerically_risky":false,"param_formula":"D*D","preserves_gradient":true},"status":"approved","tags":["recurrent","feedback","topology"],"version":"1.0.0"},{"category":"blocks","constraints":{"incompatible_with":[]},"description":"Fractal: recursive self-similar sub-networks","help_md":"### Technical\nFractal: recursive self-similar sub-networks\n\nInputs: x:tensor[B, S, D].\nOutputs: y:tensor[B, S, D].\nParams: none.\n\n### Plain Language\nFractal: recursive self-similar sub-networks\n\nUse when you need this specific transformation in a workflow.\n","id":"fractal","implementation":{"cython":null,"native":null,"python":"kernel_fallback.py","rust":null},"inputs":[{"dtype":"tensor","name":"x","shape":["B","S","D"]}],"name":"Fractal","outputs":[{"dtype":"tensor","name":"y","shape":["B","S","D"]}],"params":{},"performance":{"has_params":true,"numerically_risky":false,"param_formula":"D*D","preserves_gradient":true},"status":"approved","tags":["recursive","topology"],"version":"1.0.0"},{"category":"blocks","description":"Fused gated linear layer","help_md":"### Technical\nFused gated linear: (x @ W) * sigmoid(x @ W_gate).\n\nInputs: x:tensor[B, S, D].\nOutputs: y:tensor[B, S, out_dim].\nParams: out_dim (integer).\n\n### Plain Language\nA linear projection with a learned gate.\n","id":"gated_linear","implementation":{"cython":null,"native":"aria_gated_linear_f32","python":null,"rust":null},"inputs":[{"dtype":"tensor","name":"x","shape":["B","S","D"]}],"name":"Gated Linear","outputs":[{"dtype":"tensor","name":"y","shape":["B","S","D"]}],"params":{"out_dim":{"default":128,"description":"Output dimension","type":"integer"}},"performance":{"has_params":true,"numerically_risky":false,"param_formula":"D * out_dim * 2","preserves_gradient":true},"status":"approved","tags":["parameterized","gating"],"version":"1.0.0"},{"category":"blocks","constraints":{"incompatible_with":[]},"description":"Hourglass: progressive down/upsample","help_md":"### Technical\nHourglass: progressive down/upsample\n\nInputs: x:tensor[B, S, D].\nOutputs: y:tensor[B, S, D].\nParams: none.\n\n### Plain Language\nHourglass: progressive down/upsample\n\nUse when you need this specific transformation in a workflow.\n","id":"hourglass","implementation":{"cython":null,"native":null,"python":"kernel_fallback.py","rust":null},"inputs":[{"dtype":"tensor","name":"x","shape":["B","S","D"]}],"name":"Hourglass","outputs":[{"dtype":"tensor","name":"y","shape":["B","S","D"]}],"params":{},"performance":{"has_params":true,"numerically_risky":false,"param_formula":"D*D","preserves_gradient":true},"status":"approved","tags":["multi_scale","bottleneck","topology"],"version":"1.0.0"},{"category":"blocks","constraints":{"incompatible_with":[]},"description":"Each token routes through different layer subsets","help_md":"### Technical\nEach token routes through different layer subsets\n\nInputs: x:tensor[B, S, D].\nOutputs: y:tensor[B, S, D].\nParams: none.\n\n### Plain Language\nEach token routes through different layer subsets\n\nUse when you need this specific transformation in a workflow.\n","id":"mixture_of_paths","implementation":{"cython":null,"native":null,"python":"kernel_fallback.py","rust":null},"inputs":[{"dtype":"tensor","name":"x","shape":["B","S","D"]}],"name":"Mixture Of Paths","outputs":[{"dtype":"tensor","name":"y","shape":["B","S","D"]}],"params":{},"performance":{"has_params":true,"numerically_risky":false,"param_formula":"D*D","preserves_gradient":true},"status":"approved","tags":["dynamic_routing","sparse_compute","topology"],"version":"1.0.0"},{"category":"blocks","constraints":{"incompatible_with":[]},"description":"Parallel streams merged at intervals","help_md":"### Technical\nParallel streams merged at intervals\n\nInputs: x:tensor[B, S, D].\nOutputs: y:tensor[B, S, D].\nParams: none.\n\n### Plain Language\nParallel streams merged at intervals\n\nUse when you need this specific transformation in a workflow.\n","id":"parallel_streams","implementation":{"cython":null,"native":null,"python":"kernel_fallback.py","rust":null},"inputs":[{"dtype":"tensor","name":"x","shape":["B","S","D"]}],"name":"Parallel Streams","outputs":[{"dtype":"tensor","name":"y","shape":["B","S","D"]}],"params":{},"performance":{"has_params":true,"numerically_risky":false,"param_formula":"D*D","preserves_gradient":true},"status":"approved","tags":["parallel","topology"],"version":"1.0.0"},{"category":"blocks","constraints":{"incompatible_with":[]},"description":"Standard sequential stack (baseline)","help_md":"### Technical\nStandard sequential stack (baseline)\n\nInputs: x:tensor[B, S, D].\nOutputs: y:tensor[B, S, D].\nParams: none.\n\n### Plain Language\nStandard sequential stack (baseline)\n\nUse when you need this specific transformation in a workflow.\n","id":"sequential","implementation":{"cython":null,"native":null,"python":"kernel_fallback.py","rust":null},"inputs":[{"dtype":"tensor","name":"x","shape":["B","S","D"]}],"name":"Sequential","outputs":[{"dtype":"tensor","name":"y","shape":["B","S","D"]}],"params":{},"performance":{"has_params":true,"numerically_risky":false,"param_formula":"D*D","preserves_gradient":true},"status":"approved","tags":["standard","topology"],"version":"1.0.0"},{"category":"blocks","constraints":{"incompatible_with":[]},"description":"U-Net: encoder-decoder with skip connections","help_md":"### Technical\nU-Net: encoder-decoder with skip connections\n\nInputs: x:tensor[B, S, D].\nOutputs: y:tensor[B, S, D].\nParams: none.\n\n### Plain Language\nU-Net: encoder-decoder with skip connections\n\nUse when you need this specific transformation in a workflow.\n","id":"u_net","implementation":{"cython":null,"native":null,"python":"kernel_fallback.py","rust":null},"inputs":[{"dtype":"tensor","name":"x","shape":["B","S","D"]}],"name":"U Net","outputs":[{"dtype":"tensor","name":"y","shape":["B","S","D"]}],"params":{},"performance":{"has_params":true,"numerically_risky":false,"param_formula":"D*D","preserves_gradient":true},"status":"approved","tags":["skip_connections","multi_scale","topology"],"version":"1.0.0"},{"category":"channel_mixing","constraints":{"incompatible_with":[]},"description":"Function-space basis expansion with learned coefficients","help_md":"### Technical\nFunction-space basis expansion with learned coefficients\n\nInputs: x:tensor[B, S, D].\nOutputs: y:tensor[B, S, D].\nParams: none.\n\n### Plain Language\nFunction-space basis expansion with learned coefficients\n\nUse when you need this specific transformation in a workflow.\n","id":"basis_expansion_layer","implementation":{"cython":null,"native":null,"python":"kernel_fallback.py","rust":null},"inputs":[{"dtype":"tensor","name":"x","shape":["B","S","D"]}],"name":"Basis Expansion Layer","outputs":[{"dtype":"tensor","name":"y","shape":["B","S","D"]}],"params":{},"performance":{"has_params":true,"numerically_risky":false,"param_formula":"D*D","preserves_gradient":true},"status":"approved","tags":["functional","operator_learning","basis","channel_mixing"],"version":"1.0.0"},{"category":"channel_mixing","constraints":{"incompatible_with":[]},"description":"1D convolution with GLU gating","help_md":"### Technical\n1D convolution with GLU gating\n\nInputs: x:tensor[B, S, D].\nOutputs: y:tensor[B, S, D].\nParams: none.\n\n### Plain Language\n1D convolution with GLU gating\n\nUse when you need this specific transformation in a workflow.\n","id":"conv1d_glu","implementation":{"cython":null,"native":null,"python":"kernel_fallback.py","rust":null},"inputs":[{"dtype":"tensor","name":"x","shape":["B","S","D"]}],"name":"Conv1D Glu","outputs":[{"dtype":"tensor","name":"y","shape":["B","S","D"]}],"params":{},"performance":{"has_params":true,"numerically_risky":false,"param_formula":"D*D","preserves_gradient":true},"status":"approved","tags":["conv","channel_mixing"],"version":"1.0.0"},{"category":"channel_mixing","constraints":{"incompatible_with":[]},"description":"No channel mixing (identity / skip connection only)","help_md":"### Technical\nNo channel mixing (identity / skip connection only)\n\nInputs: x:tensor[B, S, D].\nOutputs: y:tensor[B, S, D].\nParams: none.\n\n### Plain Language\nNo channel mixing (identity / skip connection only)\n\nUse when you need this specific transformation in a workflow.\n","id":"identity_skip","implementation":{"cython":null,"native":null,"python":"kernel_fallback.py","rust":null},"inputs":[{"dtype":"tensor","name